{"contract":"reasoning-distiller-relationship-algorithm-report/1","hypothesis":{"algorithm_summary":"Enumerate every unordered pair of eligible current canonical propositions and consider all seven permitted directed or symmetric relation hypotheses for each pair. Batching is computational only and performs no semantic pruning.","expected_behavior":"A0 is expected to maximize relationship discovery recall at the cost of quadratic pair coverage: 67,528 proposition pairs and 472,696 relation hypotheses for the frozen 368-proposition corpus. It is not expected to be the production-efficient algorithm.","selection_rationale":"A0 is selected as the reference candidate because it makes no candidate-selection assumptions and therefore provides complete pair-space coverage against which pruning and indexing algorithms can be measured."},"identity":{"algorithm_id":"A0-exhaustive","algorithm_version":"1","benchmark_digest":"sha256:2c6ee3c1d1db72e3cc14b44d624e05f14fd048ef85cf5ae2ef3a3615759bfc7a","benchmark_id":"relationship-discovery-v1","execution_id":"relationship-discovery-v1-A0-exhaustive-20260821","implementation_digest":"sha256:70ad2b2b9fabb0a86ec1963e8cf1b0b31ce1b174d990f7906a1beb77e477f430"},"method":{"summary":"Sort the frozen eligible proposition corpus by canonical record ID, divide it into 32-proposition computational blocks, and assess every block pair exactly once. Within a diagonal block assess each unordered pair once; between distinct blocks assess the full Cartesian product. For every proposition pair consider supports and depends_on in both directions, supersedes in both directions, and contradicts symmetrically."},"metrics":{"assessed_batches":{"status":"measured","value":78},"assessed_hypotheses":{"status":"measured","value":472696},"assessed_pairs":{"status":"measured","value":67528},"baseline_recall_percent":{"status":"derived","unit":"%","value":100.0},"baseline_relations":{"status":"measured","value":668},"baseline_relations_covered":{"status":"derived","value":668},"baseline_relations_missed":{"status":"derived","value":0},"candidate_generation_runtime_seconds":{"status":"unavailable"},"eligible_propositions":{"status":"measured","value":368},"index_storage_bytes":{"status":"derived","value":0},"input_tokens":{"status":"unavailable"},"monetary_cost":{"status":"unavailable"},"output_tokens":{"status":"unavailable"},"pair_space_reduction_percent":{"status":"derived","unit":"%","value":0.0},"pair_space_searched_percent":{"status":"derived","unit":"%","value":100.0},"pairs_pruned":{"status":"derived","value":0},"pairs_retained":{"status":"derived","value":67528},"raw_candidate_relations":{"status":"measured","value":1128},"relationship_hypotheses_retained":{"status":"derived","value":472696},"semantic_analyses_required":{"status":"derived","value":67528},"total_possible_pairs":{"status":"derived","value":67528}},"misses":[],"notes":["The pre-result hypothesis is preserved unchanged from the report template.","All 78 exhaustive A0 semantic batches are COMPLETE and validated: 67528 unordered pairs, 472696 relationship hypotheses, and 1128 raw non-authoritative candidate relations.","Fresh Steward semantic reconciliation reviewed all 1128 raw A0 candidates and established 668 approved exhaustive baseline relations.","This reconciliation is non-admitting; canonical PEMS/COVE state remains unchanged until a separately activated admission invocation."],"verdict":"PASS"}
